{
  "$schema": "https://json-schema.org/draft/2020-12/schema",
  "title": "WorkflowDefinition",
  "type": "object",
  "required": ["workflow_id", "name", "steps", "metadata", "version", "created_at"],
  "properties": {
    "workflow_id": { "type": "string", "minLength": 1 },
    "name": { "type": "string", "minLength": 1 },
    "steps": {
      "type": "array",
      "items": {
        "type": "object",
        "required": ["step_id", "agent", "action", "config", "dependencies"],
        "properties": {
          "step_id": { "type": "string", "minLength": 1 },
          "agent": { "type": "string", "minLength": 1 },
          "action": { "type": "string", "minLength": 1 },
          "config": { "type": "object" },
          "dependencies": {
            "type": "array",
            "items": { "type": "string" }
          }
        },
        "additionalProperties": false
      }
    },
    "metadata": { "type": "object" },
    "version": { "type": "integer", "minimum": 1 },
    "created_at": { "type": "number" }
  },
  "additionalProperties": false
}
