[
  {
    "workflow_id": "hr_ops_offer_letter",
    "name": "Draft offer letter",
    "steps": [
      {
        "step_id": "s1",
        "agent": "hr_ops",
        "action": "extract_candidate_data",
        "config": {},
        "dependencies": []
      },
      {
        "step_id": "s2",
        "agent": "hr_ops",
        "action": "draft_letter",
        "config": {},
        "dependencies": ["s1"]
      },
      {
        "step_id": "s3",
        "agent": "hr_ops",
        "action": "compliance_check",
        "config": {},
        "dependencies": ["s2"]
      }
    ],
    "metadata": {
      "sector": "hr_ops",
      "icon": "🧑‍💼",
      "description": "Generate compliant offer letters for India."
    },
    "version": 1,
    "created_at": 1700000000
  },
  {
    "workflow_id": "hr_ops_onboarding_kit",
    "name": "Generate onboarding checklist",
    "steps": [
      {
        "step_id": "s1",
        "agent": "hr_ops",
        "action": "parse_role",
        "config": {},
        "dependencies": []
      },
      {
        "step_id": "s2",
        "agent": "hr_ops",
        "action": "build_checklist",
        "config": {},
        "dependencies": ["s1"]
      },
      {
        "step_id": "s3",
        "agent": "hr_ops",
        "action": "assign_owners",
        "config": {},
        "dependencies": ["s2"]
      }
    ],
    "metadata": {
      "sector": "hr_ops",
      "icon": "🗂️",
      "description": "Onboarding checklist with owners and dates."
    },
    "version": 1,
    "created_at": 1700000000
  },
  {
    "workflow_id": "hr_ops_sop_draft",
    "name": "Draft process SOP",
    "steps": [
      {
        "step_id": "s1",
        "agent": "hr_ops",
        "action": "extract_process_steps",
        "config": {},
        "dependencies": []
      },
      {
        "step_id": "s2",
        "agent": "hr_ops",
        "action": "structure_sop",
        "config": {},
        "dependencies": ["s1"]
      },
      {
        "step_id": "s3",
        "agent": "hr_ops",
        "action": "review_gaps",
        "config": {},
        "dependencies": ["s2"]
      }
    ],
    "metadata": {
      "sector": "hr_ops",
      "icon": "📝",
      "description": "Draft SOPs for recurring processes."
    },
    "version": 1,
    "created_at": 1700000000
  }
]
