[
  {
    "workflow_id": "finance_cfo_mis_report",
    "name": "Generate monthly MIS report",
    "steps": [
      {
        "step_id": "s1",
        "agent": "finance_cfo",
        "action": "parse_financials",
        "config": {},
        "dependencies": []
      },
      {
        "step_id": "s2",
        "agent": "finance_cfo",
        "action": "compute_ratios",
        "config": {},
        "dependencies": ["s1"]
      },
      {
        "step_id": "s3",
        "agent": "finance_cfo",
        "action": "write_narrative",
        "config": {},
        "dependencies": ["s2"]
      }
    ],
    "metadata": {
      "sector": "finance_cfo",
      "icon": "📊",
      "description": "Build MIS reports with ratios and narrative."
    },
    "version": 1,
    "created_at": 1700000000
  },
  {
    "workflow_id": "finance_cfo_cash_runway",
    "name": "Model cash runway scenarios",
    "steps": [
      {
        "step_id": "s1",
        "agent": "finance_cfo",
        "action": "extract_burn",
        "config": {},
        "dependencies": []
      },
      {
        "step_id": "s2",
        "agent": "finance_cfo",
        "action": "model_scenarios",
        "config": {},
        "dependencies": ["s1"]
      },
      {
        "step_id": "s3",
        "agent": "finance_cfo",
        "action": "output_dashboard",
        "config": {},
        "dependencies": ["s2"]
      }
    ],
    "metadata": {
      "sector": "finance_cfo",
      "icon": "💸",
      "description": "Runway scenarios with best/base/worst cases."
    },
    "version": 1,
    "created_at": 1700000000
  },
  {
    "workflow_id": "finance_cfo_gst_check",
    "name": "GST reconciliation readiness",
    "steps": [
      {
        "step_id": "s1",
        "agent": "finance_cfo",
        "action": "parse_gst_data",
        "config": {},
        "dependencies": []
      },
      {
        "step_id": "s2",
        "agent": "finance_cfo",
        "action": "flag_mismatches",
        "config": {},
        "dependencies": ["s1"]
      },
      {
        "step_id": "s3",
        "agent": "finance_cfo",
        "action": "output_checklist",
        "config": {},
        "dependencies": ["s2"]
      }
    ],
    "metadata": {
      "sector": "finance_cfo",
      "icon": "🧾",
      "description": "GST readiness checks with mismatch flags."
    },
    "version": 1,
    "created_at": 1700000000
  }
]
