[
  {
    "workflow_id": "real_estate_lead_summary",
    "name": "Summarise today's WhatsApp leads",
    "steps": [
      {
        "step_id": "s1",
        "agent": "real_estate",
        "action": "extract_leads",
        "config": {},
        "dependencies": []
      },
      {
        "step_id": "s2",
        "agent": "real_estate",
        "action": "rank_leads",
        "config": {},
        "dependencies": ["s1"]
      },
      {
        "step_id": "s3",
        "agent": "real_estate",
        "action": "output_brief",
        "config": {},
        "dependencies": ["s2"]
      }
    ],
    "metadata": {
      "sector": "real_estate",
      "icon": "🏠",
      "description": "Summarize lead flow from WhatsApp groups."
    },
    "version": 1,
    "created_at": 1700000000
  },
  {
    "workflow_id": "real_estate_property_brief",
    "name": "Generate listing brief",
    "steps": [
      {
        "step_id": "s1",
        "agent": "real_estate",
        "action": "parse_property_data",
        "config": {},
        "dependencies": []
      },
      {
        "step_id": "s2",
        "agent": "real_estate",
        "action": "write_brief",
        "config": {},
        "dependencies": ["s1"]
      },
      {
        "step_id": "s3",
        "agent": "real_estate",
        "action": "seo_check",
        "config": {},
        "dependencies": ["s2"]
      }
    ],
    "metadata": {
      "sector": "real_estate",
      "icon": "🏢",
      "description": "Generate structured listing briefs for brokers."
    },
    "version": 1,
    "created_at": 1700000000
  },
  {
    "workflow_id": "real_estate_buyer_match",
    "name": "Match buyers to listings",
    "steps": [
      {
        "step_id": "s1",
        "agent": "real_estate",
        "action": "extract_mandates",
        "config": {},
        "dependencies": []
      },
      {
        "step_id": "s2",
        "agent": "real_estate",
        "action": "score_inventory",
        "config": {},
        "dependencies": ["s1"]
      },
      {
        "step_id": "s3",
        "agent": "real_estate",
        "action": "output_matches",
        "config": {},
        "dependencies": ["s2"]
      }
    ],
    "metadata": {
      "sector": "real_estate",
      "icon": "🤝",
      "description": "Pair buyer mandates with matching inventory."
    },
    "version": 1,
    "created_at": 1700000000
  }
]
