[
  {
    "workflow_id": "growth_marketing_campaign_brief",
    "name": "Generate campaign brief",
    "steps": [
      {
        "step_id": "s1",
        "agent": "growth_marketing",
        "action": "parse_goal",
        "config": {},
        "dependencies": []
      },
      {
        "step_id": "s2",
        "agent": "growth_marketing",
        "action": "define_audience",
        "config": {},
        "dependencies": ["s1"]
      },
      {
        "step_id": "s3",
        "agent": "growth_marketing",
        "action": "build_brief",
        "config": {},
        "dependencies": ["s2"]
      }
    ],
    "metadata": {
      "sector": "growth_marketing",
      "icon": "🚀",
      "description": "Campaign briefs with goals, channels, and KPIs."
    },
    "version": 1,
    "created_at": 1700000000
  },
  {
    "workflow_id": "growth_marketing_content_calendar",
    "name": "Build monthly content calendar",
    "steps": [
      {
        "step_id": "s1",
        "agent": "growth_marketing",
        "action": "extract_themes",
        "config": {},
        "dependencies": []
      },
      {
        "step_id": "s2",
        "agent": "growth_marketing",
        "action": "map_calendar",
        "config": {},
        "dependencies": ["s1"]
      },
      {
        "step_id": "s3",
        "agent": "growth_marketing",
        "action": "assign_formats",
        "config": {},
        "dependencies": ["s2"]
      }
    ],
    "metadata": {
      "sector": "growth_marketing",
      "icon": "🗓️",
      "description": "Monthly content plan with themes and formats."
    },
    "version": 1,
    "created_at": 1700000000
  },
  {
    "workflow_id": "growth_marketing_ad_copy",
    "name": "Generate ad copy variants",
    "steps": [
      {
        "step_id": "s1",
        "agent": "growth_marketing",
        "action": "parse_brief",
        "config": {},
        "dependencies": []
      },
      {
        "step_id": "s2",
        "agent": "growth_marketing",
        "action": "write_variants",
        "config": {},
        "dependencies": ["s1"]
      },
      {
        "step_id": "s3",
        "agent": "growth_marketing",
        "action": "score_variants",
        "config": {},
        "dependencies": ["s2"]
      }
    ],
    "metadata": {
      "sector": "growth_marketing",
      "icon": "✍️",
      "description": "Ad copy variants with scoring and notes."
    },
    "version": 1,
    "created_at": 1700000000
  }
]
