[
  {
    "workflow_id": "healthcare_admin_appointment_flow",
    "name": "Send appointment reminders",
    "steps": [
      {
        "step_id": "s1",
        "agent": "healthcare_admin",
        "action": "fetch_schedule",
        "config": {},
        "dependencies": []
      },
      {
        "step_id": "s2",
        "agent": "healthcare_admin",
        "action": "draft_messages",
        "config": {},
        "dependencies": ["s1"]
      },
      {
        "step_id": "s3",
        "agent": "healthcare_admin",
        "action": "queue_send",
        "config": {},
        "dependencies": ["s2"]
      }
    ],
    "metadata": {
      "sector": "healthcare_admin",
      "icon": "📆",
      "description": "Appointment reminder flow for clinics."
    },
    "version": 1,
    "created_at": 1700000000
  },
  {
    "workflow_id": "healthcare_admin_daily_census",
    "name": "Format daily OPD census",
    "steps": [
      {
        "step_id": "s1",
        "agent": "healthcare_admin",
        "action": "parse_attendance",
        "config": {},
        "dependencies": []
      },
      {
        "step_id": "s2",
        "agent": "healthcare_admin",
        "action": "compute_summary",
        "config": {},
        "dependencies": ["s1"]
      },
      {
        "step_id": "s3",
        "agent": "healthcare_admin",
        "action": "format_report",
        "config": {},
        "dependencies": ["s2"]
      }
    ],
    "metadata": {
      "sector": "healthcare_admin",
      "icon": "🩺",
      "description": "Daily OPD/IPD census report formatting."
    },
    "version": 1,
    "created_at": 1700000000
  },
  {
    "workflow_id": "healthcare_admin_discharge_format",
    "name": "Format discharge summary",
    "steps": [
      {
        "step_id": "s1",
        "agent": "healthcare_admin",
        "action": "parse_notes",
        "config": {},
        "dependencies": []
      },
      {
        "step_id": "s2",
        "agent": "healthcare_admin",
        "action": "structure_summary",
        "config": {},
        "dependencies": ["s1"]
      },
      {
        "step_id": "s3",
        "agent": "healthcare_admin",
        "action": "flag_gaps",
        "config": {},
        "dependencies": ["s2"]
      }
    ],
    "metadata": {
      "sector": "healthcare_admin",
      "icon": "📋",
      "description": "Structure discharge summaries with gaps flagged."
    },
    "version": 1,
    "created_at": 1700000000
  }
]
