[
  {
    "workflow_id": "education_lesson_plan",
    "name": "Generate lesson plan",
    "steps": [
      {
        "step_id": "s1",
        "agent": "education",
        "action": "parse_topic",
        "config": {},
        "dependencies": []
      },
      {
        "step_id": "s2",
        "agent": "education",
        "action": "structure_lesson",
        "config": {},
        "dependencies": ["s1"]
      },
      {
        "step_id": "s3",
        "agent": "education",
        "action": "add_activities",
        "config": {},
        "dependencies": ["s2"]
      }
    ],
    "metadata": {
      "sector": "education",
      "icon": "📚",
      "description": "Lesson plans tailored to grade and duration."
    },
    "version": 1,
    "created_at": 1700000000
  },
  {
    "workflow_id": "education_question_paper",
    "name": "Draft question paper",
    "steps": [
      {
        "step_id": "s1",
        "agent": "education",
        "action": "parse_syllabus",
        "config": {},
        "dependencies": []
      },
      {
        "step_id": "s2",
        "agent": "education",
        "action": "generate_questions",
        "config": {},
        "dependencies": ["s1"]
      },
      {
        "step_id": "s3",
        "agent": "education",
        "action": "balance_difficulty",
        "config": {},
        "dependencies": ["s2"]
      }
    ],
    "metadata": {
      "sector": "education",
      "icon": "📝",
      "description": "Question papers with balanced difficulty."
    },
    "version": 1,
    "created_at": 1700000000
  },
  {
    "workflow_id": "education_parent_report",
    "name": "Generate parent progress report",
    "steps": [
      {
        "step_id": "s1",
        "agent": "education",
        "action": "parse_marks",
        "config": {},
        "dependencies": []
      },
      {
        "step_id": "s2",
        "agent": "education",
        "action": "compute_summary",
        "config": {},
        "dependencies": ["s1"]
      },
      {
        "step_id": "s3",
        "agent": "education",
        "action": "draft_report",
        "config": {},
        "dependencies": ["s2"]
      }
    ],
    "metadata": {
      "sector": "education",
      "icon": "👪",
      "description": "Parent-facing progress report drafts."
    },
    "version": 1,
    "created_at": 1700000000
  }
]
